{
  "schemaVersion": 1,
  "contractId": "0x49b4d1e81ceec50d64f53dea0ad2bd3f60af46e3f324265e666a1b4ea9d35c74",
  "jobId": "0xdead000000000000000000000000000000000000000000000000000000000001",
  "intentHash": "0x9999000000000000000000000000000000000000000000000000000000000001",
  "paramsHash": "0x8888000000000000000000000000000000000000000000000000000000000001",
  "resourceId": "0x7777000000000000000000000000000000000000000000000000000000000001",
  "preStateDigest": "0x6666000000000000000000000000000000000000000000000000000000000001",
  "postStateDigest": "0x5555000000000000000000000000000000000000000000000000000000000001",
  "providerReceiptHash": "0x4444000000000000000000000000000000000000000000000000000000000001",
  "timestamp": 1746979200,
  "adapterAddress": "0x000000000000000000000000000000000000beef",
  "signature": "0x0000000000000000000000000000000000000000000000000000000000000000000000000000000000000000000000000000000000000000000000000000000000"
}
